{
  "$schema": "https://json-schema.org/draft/2020-12/schema",
  "$id": "https://raw.githubusercontent.com/OneLiteFeatherNET/Voyager/main/voyager/platform/src/main/resources/schema/cup-v1.schema.json",
  "title": "Voyager cup file, version 1",
  "description": "A cup: a name, a game mode and the rotation of maps it plays, in order. Describes the format the catalogue adapters in voyager-platform read. The loader does not validate against this document at runtime; the adapters are the runtime check. The map names are checked against the map files by the loader, not by this schema.",
  "type": "object",
  "additionalProperties": false,
  "required": ["name", "mode", "mapNames"],
  "properties": {
    "$schema": {
      "type": "string",
      "description": "Relative path to this schema, so editors can find it."
    },
    "schemaVersion": {
      "type": "integer",
      "minimum": 1,
      "maximum": 1,
      "description": "The version of the file format this file is written in. Absent means 1. This schema describes version 1 only: a flat name, read as the key elytrarace:<name>."
    },
    "name": {
      "type": "string",
      "pattern": "\\S",
      "description": "The cup's name. Must not be blank."
    },
    "displayName": {
      "type": "string",
      "maxLength": 40,
      "description": "The name players read, in place of the cup's id. Optional; absent or blank means the id. Shown as plain text, never translated."
    },
    "mode": {
      "enum": ["RACE", "PRACTICE"],
      "description": "RACE scores and ranks; PRACTICE does not."
    },
    "mapNames": {
      "type": "array",
      "minItems": 1,
      "items": { "type": "string", "pattern": "\\S" },
      "description": "The maps of the rotation, in the order they are played. Each must name a map file's name."
    },
    "notes": {
      "type": "array",
      "items": { "type": "string" },
      "description": "Free text for the person editing the file. Ignored by the loader."
    }
  }
}
