{
  "$schema": "../../../../../platform/src/main/resources/schema/cup.schema.json",
  "schemaVersion": 1,
  "name": "legacy_cup",
  "displayName": "Testing Cup",
  "mode": "RACE",
  "mapNames": [
    "palmbeach",
    "dragonlobby",
    "memoria"
  ],
  "notes": [
    "Legacy cup 'Testing' (<rainbow>Testing Cup</rainbow>) from the old plugin: the three converted legacy maps."
  ]
}
